{
  "$schema": "https://transformerpath.com/gcc-intel-review.schema.json",
  "purpose": "Per-candidate human review ledger for GCC discovery. Publication requires decision=PUBLISH with reviewer and reviewed_at. HOLD is not publication.",
  "honesty": "Rows are review records, not new evidence. PUBLISH rows are the PR #16 desk release, the 9 Oct and 13 Oct items, and six September notices released on 14 Oct 2026 after their source pages were fetched. Grades were not upgraded. HOLD rows keep reviewer null.",
  "updated": "2026-10-14",
  "reviews": [
    {
      "candidate_id": "uae-dewa-2122600155",
      "evidence_status": "SUPPORTED",
      "hold_reason": null,
      "reviewer": "nishadpathak",
      "reviewed_at": "2026-10-14T07:26:01.000Z",
      "decision": "PUBLISH",
      "decision_note": "Desk release in PR #16 (commit 05fe029, author nishadpathak, 2026-10-14T11:26:01+04:00). The candidate row still has publish_decision HOLD_FOR_REVIEW; this ledger is the review record. evidence_status stays SUPPORTED.",
      "source_urls": [
        "https://www.dewa.gov.ae/en/supplier/services/list-of-tender-documents"
      ]
    },
    {
      "candidate_id": "sa-swa-rabigh-2p5mva",
      "evidence_status": "CONFIRMED",
      "hold_reason": null,
      "reviewer": "nishadpathak",
      "reviewed_at": "2026-10-14T07:26:01.000Z",
      "decision": "PUBLISH",
      "decision_note": "Desk release in PR #16 (commit 05fe029, author nishadpathak, 2026-10-14T11:26:01+04:00). The candidate row still has publish_decision REVIEW_QUEUE; this ledger is the review record. evidence_status stays CONFIRMED.",
      "source_urls": [
        "https://tenders.etimad.sa/Tender/DetailsForVisitor?STenderId=YYulueYsiIAkLL3QtkpaYQ==",
        "https://www.tenderdetail.com/Global-Tenders/TenderNotice/117055177/17B9D72B-E5DC-44E1-9FC4-5FF68C761BAD"
      ]
    },
    {
      "candidate_id": "sa-swa-jubail-grounding",
      "evidence_status": "SUPPORTED",
      "hold_reason": null,
      "reviewer": "transformerpath-desk",
      "reviewed_at": "2026-10-14T10:36:53Z",
      "decision": "PUBLISH",
      "decision_note": "Fetched https://bidsfactory.com/en/tenders/3304-4-saudi_etimad-40d892d6879b8761 on 2026-10-14. HTTP 200. Page is the 33/0.4 kV grounding transformer at Jubail Phase 4 for the Saudi Water Authority, published 3 Sep 2026. Aggregator page, so evidence_status stays SUPPORTED.",
      "source_urls": [
        "https://bidsfactory.com/en/tenders/3304-4-saudi_etimad-40d892d6879b8761"
      ]
    },
    {
      "candidate_id": "sa-al-aflaj-33kv-replacement",
      "evidence_status": "SUPPORTED",
      "hold_reason": null,
      "reviewer": "transformerpath-desk",
      "reviewed_at": "2026-10-14T10:36:53Z",
      "decision": "PUBLISH",
      "decision_note": "Fetched the TenderImpulse page on 2026-10-14. HTTP 200. Page is the 33 kV transformer replacement at station No. 6, Technical College for Girls, published and closing 18 Sep 2026. The earlier 8 Sep date was not on the page and was corrected. Aggregator page, so evidence_status stays SUPPORTED.",
      "source_urls": [
        "https://tenderimpulse.com/government-tenders/saudi-arab/replacement-of-the-33-kv-transformer-for-station-no-6-with-the-technical-college-14893514"
      ]
    },
    {
      "candidate_id": "sa-dhahran-1500kva-standby",
      "evidence_status": "SUPPORTED",
      "hold_reason": null,
      "reviewer": "transformerpath-desk",
      "reviewed_at": "2026-10-14T10:36:53Z",
      "decision": "PUBLISH",
      "decision_note": "Fetched https://bidsfactory.com/en/tenders/1500-saudi_etimad-8a384ba1b679c3e3 on 2026-10-14. HTTP 200. Page is the 1,500 kVA standby transformer for King Abdulaziz Air Base Hospital, Dhahran, published 14 Sep 2026. Aggregator page, so evidence_status stays SUPPORTED.",
      "source_urls": [
        "https://bidsfactory.com/en/tenders/1500-saudi_etimad-8a384ba1b679c3e3"
      ]
    },
    {
      "candidate_id": "sa-swa-yanbu-t803-supervision",
      "evidence_status": "SUPPORTED",
      "hold_reason": null,
      "reviewer": "transformerpath-desk",
      "reviewed_at": "2026-10-14T10:36:53Z",
      "decision": "PUBLISH",
      "decision_note": "Fetched the TenderImpulse page on 2026-10-14. HTTP 200. Page names supervision of transformer T803 replacement at the Saudi Water Authority Yanbu desalination station, published 3 Sep 2026, deadline 10 Sep 2026. The original supply float is not redated. Aggregator page, so evidence_status stays SUPPORTED.",
      "source_urls": [
        "https://tenderimpulse.com/government-tenders/saudi-arab/project-for-the-supervision-of-the-replacement-of-major-gas-solving-bars-gib-and-14656272"
      ]
    },
    {
      "candidate_id": "kw-mewre-75mva-stage1",
      "evidence_status": "SUPPORTED",
      "hold_reason": null,
      "reviewer": "transformerpath-desk",
      "reviewed_at": "2026-10-14T10:36:53Z",
      "decision": "PUBLISH",
      "decision_note": "Fetched the TenderImpulse page on 2026-10-14. HTTP 200. Ministry of Electricity tender to replace damaged transformers up to 75 MVA and reactors up to 50 MVA, first stage, published 7 Sep 2026, deadline 6 Oct 2026. A 12 Sep event date was not on the page and was corrected. Kept as its own card, distinct from stage 2. Aggregator page, so evidence_status stays SUPPORTED.",
      "source_urls": [
        "https://tenderimpulse.com/government-tenders/kuwait/replacement-and-substitution-of-damaged-transformers-up-to-a-capacity-of-75-mva-14709840"
      ]
    },
    {
      "candidate_id": "kw-mewre-75mva-relocation",
      "evidence_status": "SUPPORTED",
      "hold_reason": {
        "code": "REVIEW_REQUIRED",
        "text": "BidDetail returned HTTP 200 on 2026-10-14 and the title for dismantling, relocation and installation of one 75 MVA power transformer in Kuwait. The date is behind the paywall and was not on the fetched page."
      },
      "reviewer": null,
      "reviewed_at": null,
      "decision": "HOLD",
      "decision_note": "Held. Title is visible; the date is not. reviewer stays null.",
      "source_urls": [
        "http://www.biddetail.com/latest-tenders/117573786$d84ae31a-0b12-4035-93f7-f0d7cdc01f0d"
      ]
    },
    {
      "candidate_id": "kw-mewre-75mva-stage2",
      "evidence_status": "SUPPORTED",
      "hold_reason": null,
      "reviewer": "transformerpath-desk",
      "reviewed_at": "2026-10-14T10:36:53Z",
      "decision": "PUBLISH",
      "decision_note": "Fetched the TenderImpulse page on 2026-10-14. HTTP 200. Same ministry, second phase, transformers up to 75 MVA, published 31 Aug 2026, deadline 29 Sep 2026. A 24 Sep event date was not on the page and was corrected. Kept as its own card, distinct from stage 1. Aggregator page, so evidence_status stays SUPPORTED.",
      "source_urls": [
        "https://tenderimpulse.com/government-tenders/kuwait/maintenance-and-replacement-of-damaged-parts-and-civil-works-related-to-a-number-14608275"
      ]
    },
    {
      "candidate_id": "om-localisation-aug12",
      "evidence_status": "CONFIRMED",
      "hold_reason": {
        "code": "DUPLICATE_OF_CURATED",
        "text": "A near-duplicate is already in curated GCC intel. Rechecked 2026-10-14: Times of Oman and The Arabian Stories still describe the RO 15 million agreements; Oman Observer returned HTTP 502. Not injected a second time. event_date stays 2026-08-12."
      },
      "reviewer": null,
      "reviewed_at": null,
      "decision": "HOLD",
      "decision_note": "Held as a duplicate of the curated card. reviewer stays null.",
      "source_urls": [
        "https://www.omanobserver.om/article/1194395/business/ro-15m-pacts-signed-to-drive-local-production-of-transformer-components",
        "https://www.omanobserver.om/article/1196433/business/oman-localises-transformer-production",
        "https://www.thearabianstories.com/2026/09/19/oman-localises-transformer-production-with-ro-15-million-investment/",
        "https://timesofoman.com/article/175526-ten-agreements-signed-to-localise-electrical-transformer-component-manufacturing-in-oman"
      ]
    },
    {
      "candidate_id": "bh-ewa-389-2026-1000kva",
      "evidence_status": "CONFIRMED",
      "hold_reason": null,
      "reviewer": "nishadpathak",
      "reviewed_at": "2026-10-14T07:26:01.000Z",
      "decision": "PUBLISH",
      "decision_note": "Desk release in PR #16 (commit 05fe029, author nishadpathak, 2026-10-14T11:26:01+04:00). The candidate row still has publish_decision REVIEW_QUEUE; this ledger is the review record. evidence_status stays CONFIRMED.",
      "source_urls": [
        "https://www.tenderboard.gov.bh/",
        "https://tenderimpulse.com/government-tenders/bahrain/supply-of-substation-oil-1000kva-with-board-14577184"
      ]
    },
    {
      "candidate_id": "bh-ewa-aml-sep-review",
      "evidence_status": "WEAK",
      "hold_reason": {
        "code": "REVIEW_REQUIRED",
        "text": "No source URL and no event date. Placeholder only; do not infer an approved-manufacturer list."
      },
      "reviewer": "transformerpath-desk",
      "reviewed_at": "2026-10-14T10:36:53Z",
      "decision": "REJECT",
      "decision_note": "Rejected on 2026-10-14. sources[] is empty, so nothing was fetched. Not published.",
      "source_urls": []
    },
    {
      "candidate_id": "qa-sept-zero",
      "evidence_status": "CONFIRMED",
      "hold_reason": {
        "code": "INTERNAL_COVERAGE_ONLY",
        "text": "Coverage fact only, not an Intel card. km.qa timed out on 2026-10-14, so the September zero was not reconfirmed. Zero stays a valid result."
      },
      "reviewer": null,
      "reviewed_at": null,
      "decision": "HOLD",
      "decision_note": "Held as internal coverage. reviewer stays null. Not an Intel card.",
      "source_urls": [
        "https://www.km.qa/"
      ]
    },
    {
      "candidate_id": "gcc-uae-saudi-grid-mou-2026-10-09",
      "evidence_status": "SUPPORTED",
      "hold_reason": null,